{
  "schema": "havenwild.asset_local_import_instructions.v0_1",
  "updated": "2026-09-16T02:55:01+00:00",
  "purpose": "LPC source is already mirrored locally.",
  "rules": {
    "preferredMode": "promote_from_assets/source/licensed/lpc_revised"
  },
  "records": [
    {
      "externalSourceId": "elizawy_lpc",
      "displayName": "ElizaWy/LPC",
      "localImportStatus": "candidate_ready_from_pinned_source",
      "preferredWorkspaceImportPath": "assets/source/licensed/lpc_revised",
      "preferredQuarantinePath": "assets/reference_quarantine/third_party/elizawy_lpc",
      "acceptedInputFiles": [
        "Terrain/terrain_summer.png",
        "Characters/Body/Body 02 - Masculine, Thin/Tan/Walk.png"
      ],
      "acceptedInputNotes": [
        "Full LPC source tree is mirrored and indexed."
      ],
      "dryRunCommand": "python tools/automation/assets/Promote-LpcRuntimeAssets.py",
      "editorDisplay": "show_slice_catalog",
      "runtimeUseRule": "allowed after explicit semantic binding and attribution",
      "instruction": "Use the LPC slice catalog to promote exact 32x32 cells into runtime manifests."
    }
  ]
}
